<?xml version="1.0" encoding="UTF-8" standalone="no"?>
<!DOCTYPE table_name13 SYSTEM "table_name13.dtd">
<table_name13>
<element>
<column_name1 type="varchar">'value1'</column_name1>
<column_name3 type="varchar">'value3'</column_name3>
<column_name2 type="int">4</column_name2>
</element>
<element>
<column_name1 type="varchar">'value1'</column_name1>
<column_name2 type="int">8</column_name2>
<column_name3 type="varchar">'value3'</column_name3>
</element>
</table_name13>
